;;;;;;;;;;;;;;;;;;;;;;;;;;;;;x;;;;;;;;;;;;;;;;;;;;;;
Gaba202201.A;Focus on everything BUT the Baltic Sea.;;;;;;;;;;;;;;;;;;;;;;;;;;;;;;;;;;;;;;;;;;;;;;;;;;
Gaba202201.B;Expand everywhere EXCEPT towards the Black Sea.;;;;;;;;;;;;;;;;;;;;;;;;;;;;;;;;;;;;;;;;;;;;;;;;;;
Gaba202201.C;Everything BUT Pan-slavism!;;;;;;;;;;;;;;;;;;;;;;;;;;;;;;;;;;;;;;;;;;;;;;;;;;
synthetic_sulphur_factory;Nitrate Plant;;;;;;;;;;;;;
synthetic_sulphur_factory_desc;The Haber Process allows the synthetic creation of Nitrate for fertilizer.;;;;;;;;;;;;;
synthetic_sulphur_factory_i;Nitrate Plant;;;;;;;;;;;;;
synthetic_sulphur_factory_i_desc;The Haber Process allows the synthetic creation of Nitrate for fertilizer.;;;;;;;;;;;;;
bureaucrats_fix_title;Non-Accepted Bureaucrats Decision (10 year cooldown);;;;Decision sobre los bur贸cratas no aceptados.;;;;;;;;;
bureaucrats_fix_desc;This decision is intended to convert non-accepted Bureaucrats into Artisans, in both states and colonies, so they stop getting fat off of state admin funding.;;;;Esta decisi贸n pretende convertir a los bur贸cratas no aceptados en artesanos, tanto en los estados como en las colonias, para que dejen de engordar con los fondos de la administraci贸n estatal.;;;;;;;;;